{"os":"Darwin","architecture":"arm64","hook_version":"0.1.0","commit":"e7fc82f","build_profile":"release","timestamp_utc":"2026-07-17T21:37:01Z","iterations":100,"warmup":10,"binary_size_bytes":642080,"safe":{"p50_ns":3452000,"p95_ns":3861000,"max_ns":4209000},"suspicious_allow":{"p50_ns":3625000,"p95_ns":4130000,"max_ns":4785000},"suspicious_deny":{"p50_ns":3592000,"p95_ns":4198000,"max_ns":5103000},"peak_rss_bytes":2031616,"method":"persistent Perl Time::HiRes CLOCK_MONOTONIC harness; one hook process per sample","limitations":["Peak RSS is a representative macOS /usr/bin/time -l sample, not a per-iteration distribution.","Process startup and stdin parsing are included; filesystem fixtures are temporary and local.","Published measurements require the persistent Perl harness; the POSIX fallback is lower-resolution and timer-process biased."]}
